title,content,date,url
"'삼성 어떡하나' 강민호 무릎에 이상 신호 ""병원서 검진 받을 예정"""," [스포티비뉴스=사직, 윤욱재 기자] 삼성 '레전드 포수' 강민호(40)가 병원 검진을 받는다. 강민호는 17일 부산 사직구장에서 열린 2025 신한 SOL뱅크 KBO 리그 롯데와의 더블헤더 1차전에서 3번타자 포수로 선발 출전했다. 양팀이 5-5로 맞선 8회말 좌완투수 이승민와 배터리 호흡을 맞춘 강민호는 투구를 받는 과정에서 왼쪽 무릎에 부상을 입었고 결국 김재성과 교체됐다. 강민호는 좌타자 고승민을 상대로 볼카운트 3B에서 바깥쪽 공을 요구했으나 이승민이 몸쪽으로 공을 던지면서 이를 잡기 위해 몸을 던져야 했다. 공교롭게도 삼성은 강민호가 그라운드를 떠나자마자 빅터 레이예스에 우전 적시타를 맞고 5-7 역전을 당했다. 결과는 삼성의 5-7 2점차 석패였다. 삼성 관계자는 ""강민호가 수비 과정에서 왼쪽 무릎 뒤틀림이 발생했다. 이로 인한 통증으로 아이싱 후 병원에서 검진을 받을 예정이다""라고 밝혔다. 따라서 강민호의 부상 정도는 병원 검진 결과에 따라 정확히 알 수 있을 전망이다. 삼성은 이날 롯데와의 더블헤더 2차전에 나설 선발 라인업에 강민호를 제외했다. 대신 김재성이 선발 마스크를 쓴다. 구자욱(지명타자)-김성윤(중견수)-류지혁(2루수)-르윈 디아즈(1루수)-이성규(우익수)-김헌곤(좌익수)-김영웅(3루수)-김재성(포수)-이재현(유격수)을 1~9번 타순에 배치한 삼성은 우완투수 최원태를 선발투수로 내세운다. 강민호는 역대 KBO 리그 포수 최다인 340홈런을 기록 중인 선수로 지난 해 136경기에 나와 타율 .303 19홈런 77타점을 남기면서 포수 부문 골든글러브를 수상했다. 올해는 42경기에서 타율 .277 2홈런 28타점을 기록하고 있다.   <저작권자 ⓒ SPOTV NEWS. 무단전재 및 재배포 금지>",2025. 5. 17. 17:51,http://v.daum.net/v/20250517175138854
"5-0 리드에도 역전패, 삼성라이온즈…'레예스의 불운·디아즈의 침묵' DH 1차전 내줬다"," 5회까지 완벽에 가깝게 이어진 선발의 호투와 5-0의 리드에도 삼성라이온즈가 경기 막판 충격의 역전패로 더블헤더 첫 경기를 내줬습니다. 17일 오후 부산 사직야구장에서 펼쳐진 2025 신한 SOL 뱅크 KBO리그 롯데자이언츠와의 더블헤더 1차전에서 삼성은 6회말 대거 5점으로 동점, 8회말엔 2점을 더 내주며 5점 차 리드를 2점 차 5-7 패배로 마무리합니다. 더워진 날씨와 함께 본인의 모습을 되찾은 선발 레예스가 5회까지 안타 2개, 볼넷 1개 무실점의 완벽투를 펼친 삼성은 2회초 타자들의 집중력을 바탕으로 3점을 먼저 앞서갑니다. 3회와 5회에도 한 점씩 더했던 삼성은 6회초 결정적 득점 찬스에서 디아즈가 병살타로 물러나며 분위기가 꺾였습니다. 묘하게 흐름을 내준 삼성은 6회말 롯데 레이예스 3점 홈런으로 추격의 발판을 마련했고, 이어나온 김태훈이 2점을 더 내주며 동점을 허용합니다. 완벽투를 이어가던 레예스는 시즌 4번째 승리 사냥에 실패했고, 팀도 빠르게 불펜을 가동하며 더블헤더 경기 운용 계획인 틀어진 모습을 보여줍니다. 7회초 찬스도 이성규의 병살타로 무산된 삼성은 결국, 김재윤과 이승민이 흔들리며 8회말 역전을 허용하며, 5점 차 리드를 지키지 못한 패배로 더블헤더의 시작을 마무리해 아쉬움을 더했습니다.  타선에서는 김성윤이 3안타, 구자욱과 류지혁도 2안타로 좋은 모습을 보였지만, 믿었던 디아즈가 홈런은 커녕, 안타도 하나 없이 볼넷 하나에 그쳐 상대 타선에 비해 상대적인 약한 모습을 보인 점이 패인으로 꼽힙니다. 포항 위닝시리즈의 좋은 기운을 이어가려 했던 삼성은 초반 리드에도 역전패로 충격이 예상되는 가운데 2차전에서 최원태를 선발로 분위기 반전을 꾀합니다.(사진제공-삼성라이온즈)",2025. 5. 17. 18:04,http://v.daum.net/v/20250517180432101
"'5점차 뒤집기' 롯데, 삼성에 역전승…레이예스 추격포·결승타 '펄펄'"," [서울=뉴시스]김희준 기자 = 프로야구 롯데 자이언츠가 5점차 열세를 뒤집고 삼성 라이온즈에 역전승을 거뒀다. 롯데는 17일 사직구장에서 벌어진 2025 신한 쏠뱅크 KBO리그 삼성과의 경기에서 8회 터진 빅터 레이예스의 역전 결승타에 힘입어 7-5로 승리했다. 시즌 26승째(2무 18패)를 따낸 롯데는 단독 3위 자리를 지켰다. 삼성의 시즌 성적은 21승 1무 23패가 됐다. 5회까지는 삼성의 분위기가 좋았다. 삼성은 2회초 김헌곤의 몸에 맞는 공과 이재현의 우전 안타로 만든 1사 1, 3루에서 구자욱이 좌전 적시 2루타를 날려 선취점을 뽑았다. 후속타자 김성윤이 우익수 방면 2루타를 날리면서 삼성은 3-0 리드를 잡았다. 삼성은 4회초 류지혁의 안타와 김헌곤의 희생번트, 이성규의 적시 2루타를 묶어 1점을 더했다. 5회에도 추가점을 냈다. 5회초 류지혁의 2루타와 김헌곤의 희생번트로 이은 1사 3루에서 이성규가 희생플라이를 때렸다. 삼성 선발 데니 레예스 공략에 애를 먹으며 5회까지 한 점도 내지 못하던 롯데는 6회에만 5점을 올리며 승부를 원점으로 돌렸다. 6회초 장두성, 고승민의 연속 안타로 일군 무사 1, 3루에서 레이예스가 우월 3점포(시즌 5호)를 작렬했다. 레이예스는 레예스의 시속 137㎞ 몸쪽 높은 컷 패스트볼을 잡아당겨 오른쪽 담장을 넘겼다. 전준우의 2루타와 정훈의 내야안타로 일군 무사 1, 3루에서 윤동희의 유격수 땅볼 때 3루 주자 전준우가 득점해 1점을 더 뽑은 롯데는 이후 1사 만루에서 전민재가 희생플라이를 뽑아내 동점 점수를 냈다. 기세를 끌어올린 롯데는 8회 역전까지 성공했다. 8회말 전민재의 안타와 장두성, 고승민의 연속 볼넷으로 2사 만루를 만들었고, 레이예스가 2타점 우전 적시타를 터뜨렸다. 7-5 리드를 잡은 롯데는 9회초 마무리 투수 김원중을 투입했다. 김원중은 삼자범퇴 이닝을 만들고 팀 승리를 지켜 시즌 11세이브째(1승)를 수확했다. 레이예스는 4타수 2안타 5타점을 올리며 해결사 면모를 한껏 과시했다. 롯데 토종 에이스 박세웅은 5이닝 8피안타 5탈삼진 4사사구 5실점으로 다소 흔들렸으나 타선이 뒷심을 발휘해준 덕에 패전을 면했다. 홍민기(1이닝), 정현수(⅓이닝), 정철원(1⅓이닝), 송재영(⅓이닝)으로 이어진 롯데 불펜진이 무실점 투구를 펼치면서 역전승의 발판을 놨다. 삼성을 레예스가 6회 급작스럽게 난조를 보인 뒤 불펜까지 무너지면서 아쉽게 역전패를 떠안았다. ☞공감언론 뉴시스 jinxijun@newsis.com",2025. 5. 17. 17:25,http://v.daum.net/v/20250517172539421
"'0:5→7:5' 매진갈매기 대역전극! '3점포+결승타' 레이예스 5타점 원맨쇼…'약속의 8회' 롯데, 삼성에 DH 1차전 승 [부산리뷰]","   [부산=스포츠조선 김영록 기자] 2만2669개 좌석이 모두 매진된 사직구장의 응원은 남달랐다. 파도 같은 함성이 경기 내내 사직동에 물결쳤다. 대통령 선거유세의 확성기 소리를 압도했다. 롯데 자이언츠는 17일 부산 사직구장에서 열린 삼성 라이온즈와의 더블헤더 1차전에서 7대5로 승리했다. 팀타율 1~2위팀의 격돌답게 양팀을 대표하는 에이스들이 출격했음에도 타격전 양상으로 이어졌다. 선발 박세웅이 5이닝 5실점으로 흔들렸기에 더욱 귀중한 역전승이었다. 롯데는 1차전 승리로 선두 LG 트윈스, 2위 한화 이글스를 향한 추격에 한층 더 박차를 가했다. 반면 패배한 삼성은 지옥 같은 중위권 싸움에 직면해있다. 전날 기준 4위 삼성부터 공동 7위 KIA-두산-KT까지 단 1경기 차이. 악몽같은 8연패를 탈출했지만, 초반 5점차 리드를 잡은데다 외국인 에이스까지 출격한 경기에서 허무한 역전패를 당했다.  이날 롯데는 장두성(중견수) 고승민(2루) 레이예스(좌익수) 전준우(지명타자) 나승엽(1루) 윤동희(우익수) 유강남(포수) 손호영(3루) 이호준(유격수) 라인업으로 임했다. 선발은 박세웅. 삼성은 구자욱(지명타자) 김성윤(중견수) 강민호(포수) 디아즈(1루) 김영웅(3루) 류지혁(2루) 김헌곤(좌익수) 이성규(우익수) 이재현(유격수)으로 맞섰다. 선발투수는 레예스. 롯데로선 '복덩이' 전민재와 필승조 후보 최준용이 돌아왔다. 최준용은 스프링캠프에서 팔꿈치 부상으로 이탈한 이래 올해 첫 1군 승격이고, 전민재는 '헤드샷' 사구 이후 첫 복귀다. 새 외인 알렉 감보아도 아직 비자는 나오지 않았지만, 이날 사직구장에 합류해 선수단과 첫 인사를 나눴다. 김태형 롯데 감독은 ""전민재의 컨디션은 문제없는 것 같다. 상황 봐서 대타나 대수비로 활용하겠다""면서 ""최준용은 타이밍을 잘 잡아야할 거 같다. 너무 어려운 상황에 투입하면 부담이 될 것 같다""고 돌아봤다. 최준용이 정철원 김원중의 부담을 덜어주길 바라는 마음도 드러냈다. 박진만 삼성 감독은 ""레예스에게 잘 맞는 날씨""라며 뜨거운 날씨를 반겼다. 이어 8연패 탈출에 이어 시리즈위닝까지 달성한 지난 포항 KT전을 돌아보며 ""좀 힘들었는데, 그래도 분위기가 많이 밝아졌다""며 웃었다.  박세웅은 1회부터 2사 만루 위기를 겪는 등 평소같지 않았다. 2회에도 선두타자 김헌곤에게 몸에 맞는볼, 1사 후 이재현에게 안타를 맞으며 1사 1,3루 위기가 이어졌다. 결국 구자욱의 좌익선상 2루타가 터지며 삼성이 선취점을 가져갔다. 이어 김성윤의 2타점 2루타가 이어지며 삼성의 3-0 리드. 박진만 감독은 확실한 굳히기를 노리고 거듭된 희생번트로 박세웅을 압박했다. 3회 선두타자 류지혁의 안타 후 번트로 1사 2루를 만들었고, 이성규의 1타점 2루타로 4-0을 만들었다. 5회에도 류지혁이 2루타로 출루한 뒤 김헌곤의 번트로 1사 3루를 만들고, 이성규의 희생플라이로 5-0까지 앞서갔다. 반면 롯데는 1회 선두타자 장두성의 안타와 도루, 4회 고승민의 2루타로 무사 2루 찬스를 잡았지만 살리지 못했다. 그런데 6회초 수비가 묘하게 터닝포인트가 됐다. 롯데의 신예 좌완 파이어볼러 홍민기가 투입됐고, 구자욱의 2루타와 김성윤의 번트 안타로 무사 1,3루 위기를 맞이했다. 하지만 강민호를 삼진으로 돌려세운데 이어 디아즈를 병살타로 잡아내며 실점없이 넘겼다.  기세를 탄 롯데는 6회말 단숨에 5득점하며 승부를 원점으로 돌렸다. 장두성 고승민의 연속 안타, 그리고 레이예스의 시즌 5호 3점홈런이 터졌다. 삼성은 2번째 투수 김태훈을 투입했지만, 롯데는 전준우의 2루타와 삼성 유격수 이재현의 실책, 윤동희의 내야땅볼로 1점을 추가했다. 이어 유강남이 볼넷을 얻어내며 1사 만루 찬스를 이어갔다. 필승조 백정현을 조기 투입돼 손호영을 1루 땅볼에 이은 홈아웃으로 처리했다. 하지만 롯데는 대타 전민재 카드를 꺼냈고, 우중간 희생플라이로 기어코 5-5 동점을 만들었다. 롯데는 7회초에도 1사1,2루 위기에 직면했지만, 삼성 이성규의 2루 옆쪽 빠질듯한 안타성 타구를 고승민이 낚아채 글러브토스, 고급스런 병살플레이로 연결해 사직구장을 끓어오르게 했다.  7회말 선두타자 고승민 때 유격수 실책, 레이예스의 볼넷, 전준우의 희생번트로 1사 2,3루 역전 찬스를 잡았다. 하지만 정훈 윤동희가 범타에 그쳤다. 삼성은 필승조 이호성이 마무리로 이동하면서 불펜 한자리가 애매한 상황. 롯데는 8회말 2사 후 전민재의 안타로 흐름을 만들었고, 삼성의 4번째 투수 이승민은 연속 볼넷으로 만루를 자초했다. 그리고 이날의 해결사 레이예스가 2타점 적시타를 때려내며 승부를 뒤집었다. 홍민기로 6회를 잘 넘긴 롯데는 정철원(1⅓이닝)과 정현수-송재영(이상 ⅓이닝)을 묶어 8회까지 버텼고, 9회 등판한 마무리 김원중이 경기를 마무리지었다.  부산=김영록 기자 lunarfly@sportschosun.com",2025. 5. 17. 17:24,http://v.daum.net/v/20250517172411395
"키키 하음, 삼성 라이온즈 'GEN Z 시구'"," (MHN 김예품 인턴기자) 그룹 키키(KI-KI)의 하음이 최근 연패에 빠진 삼성 라이온즈의 침체된 분위기를 '청량 블루' 빛으로 반전시킬 전망이다. 삼성 라이온즈는 오는 25일 오후 2시 대구 삼성 라이온즈 파크에서 열리는 기아 타이거즈와의 경기에 하음을 스페셜 시구자로 초청했다고 밝혔다. 유니크하고 몽환적인 음색과 매력적인 눈매의 비주얼을 가진 하음은 키키의 보컬과 래퍼, 댄서를 담당하는 다재다능 캐릭터다. 콘셉트 소화력 또한 뛰어나 자체 콘텐츠와 각종 무대에서 독보적인 분위기를 발산하며 '차세대 트렌드 아이콘'으로 주목받고 있다.  시구자로 나서게 된 하음은 소속사 스타쉽엔터테인먼트를 통해 ""데뷔 후 첫 시구를 삼성 라이온즈에서 초청해 주셔서 너무 영광이고, 저희 키키의 팀명처럼 모든 관객분들과 선수분들에게 밝고 긍정적인 에너지를 드릴 수 있었으면 좋겠다""고 소감을 전했다. 이어 ""올 시즌 끝까지 선수분들 모두 다치지 말고 화이팅입니다! 25일에 만나요!""라며 응원의 메시지도 덧붙였다.  사진=MHN DB",2025. 5. 17. 15:59,http://v.daum.net/v/20250517155918608
"이재용 회장, 삼성 준감위와 간담회 뒤늦게 확인…""정경유착 오해도 안돼"""," 삼성 준법감시위원회가 이재용 삼성전자 회장(사진)과 지난해 11월 간담회를 갖고 준법경영에 관해 논의한 것으로 확인됐다. 준감위는 그간 이 회장을 지속적으로 만나 준법경영 관련 현안을 논의해 왔다. 준감위는 16일 공개한 '2024년 연간 보고서'를 통해 ""위원회 출범 이후 이 회장과 지속적으로 만남을 갖고 준법경영에 대한 논의를 이어오고 있다""고 밝혔다. 이어 ""앞선 간담회에서 위원회는 이 회장에게 준법 위반 리스크가 발생하지 않도록 노력해 줄 것을 당부하고 사내 준법문화 정착을 위해 더 관심을 기울여 달라고 요청했다""고 설명했다. 이 회장은 준감위 활동방향에 동참하겠다는 취지의 답을 한 것으로 전해졌다. 준감위는 지난해 11월 이 회장과 간담회를 진행했다. 당시 간담회에선 준감위원들과 이 회장이 준법경영에 관해 격의 없이 의견을 나눴다고 한다. 준감위는 삼성 관계사 7곳이 매년 진행하는 준법통제기준 운영 평가 과정에 참여하고 있다. 이 평가 결과는 관계사 이사회에 보고된다. 지난 2월엔 관계사 7곳 소속 준법지원·감시인 전원이 참석해 회사별 평가 결과를 공유하고 준감위원들과 관련 논의를 진행하는 자리를 가졌다. 이 자리는 개선점을 도출하고 준법통제 우수 사례가 다른 관계사로 확산하는 장이 됐다는 평가다. 준감위는 같은 달 루마니아·폴란드·헝가리 등 동유럽 지역 삼성 관계사 사업장도 방문해 준법경영 현황을 점검했다. 한국경제인협회 가입 여부를 놓고 숙고를 거듭했다는 내용도 언급됐다. 이찬희 준감위원장은 발간사를 통해 ""지난해 삼성의 한경협 가입을 두고 숙고에 숙고를 거듭했다""며 ""회원을 보호하고 목소리를 대변할 경제인단체는 필요하지만 단체가 정치권력의 전리품이 되거나 로비 창구가 되면 안 된다""고 했다. 준감위는 지난해 8월 삼성 관계사의 한경협 회비 납부 여부를 놓고 ""자율적 판단에 따라 결정하도록 했다""고 밝힌 바 있다. 사실상 한경협 가입 승인을 결정한 것이다. 이 위원장은 ""기업이 눈앞의 이익 추구나 불이익 회피를 위해 정경유착의 유혹에 빠진 경우 얼마나 혹독한 뒷감당을 했는지 역사가 말해주고 있다""며 ""국민 기업으로까지 평가받는 삼성은 특히 정경유착으로 오해받는 일조차 없어야 할 것이고 위원회 역시 공정과 혁신의 두 날개로 힘차게 도약할 삼성의 발목을 잡는 부당한 외압을 막아내는 준법의 방파제가 되겠다""고 강조했다. 그러면서 ""위원회의 존재와 활동에 대한 외부의 다양한 비판을 겸허하게 수용하면서 더욱 철저한 준법감시 체계를 구축하겠다""고 약속했다. 지난 3월 별세한 고(故) 한종희 삼성전자 부회장에 대해선 ""평소 준법경영에 대한 굳은 신념으로 위원회의 활동을 적극 지원해주신 한 부회장님께 진심으로 감사드리며 영면을 기원한다""고 했다. 김대영 한경닷컴 기자 kdy@hankyung.com",2025. 5. 16. 16:35,http://v.daum.net/v/20250516163502189
허리띠 졸라매는 '삼성 TV',"삼성전자 내 TV사업을 담당하는 영상디스플레이(VD)사업부가 허리띠를 졸라맨다. VD사업부는 19년 연속 전 세계 TV 시장 1위를 수성하고 있지만, 중국 기업들의 저가 공세와 글로벌 소비 위축 등에 대응하고자 이러한 결정을 내렸다. 16일 가전업계에 따르면, 삼성전자 VD사업부는 최근 내부 공지를 통해 임직원 경비 운영을 강화한다고 알렸다. 이에 따라 △회의비는 예산 내 사용 원칙을 철저히 준수하고 △거래처 방문 시 사용되는 행사비는 방문 목적 외 지원을 금지하며 △소모품비는 불요불급한 비용을 줄이는 방향으로 집행한다. 아울러 해외 출장은 건수를 최소화하고 일수도 단축하기로 했다. 업계 관계자는 ""중국 기업들이 원가 경쟁력을 앞세워 빠르게 점유율을 늘리고 있어 삼성이 지배력을 유지하려면 내부 효율성을 높이는 것이 불가피해 보인다""고 설명했다. 삼성전자는 2006년부터 지난해까지 19년 연속 글로벌 TV 시장에서 점유율 1위를 지켜오고 있다. 하지만 중국 TCL, 하이센스 등 후발 업체들이 가격 경쟁력을 앞세워 중저가 시장에서 존재감을 확대하면서, 삼성전자 역시 전반적인 운영 효율을 다시 정비하고 나선 것으로 풀이된다. [이상덕 기자]",2025. 5. 16. 20:18,http://v.daum.net/v/20250516201803271
[프로야구 부산 DH 1차전 전적] 롯데 7-5 삼성,▲ 부산 더블헤더(DH) 1차전 전적(17일) 삼성 031 010 000 - 5 롯데 000 005 02X - 7 △ 승리투수 = 송재영(1승) △ 세이브투수 = 김원중(1승 11세이브) △ 패전투수 = 김재윤(1승 2패 5세이브) △ 홈런 = 레이예스 5호(6회3점·롯데) (서울=연합뉴스) ▶제보는 카톡 okjebo,2025. 5. 17. 17:23,http://v.daum.net/v/20250517172356383
