title,content,date,url
30년 전 미디어오늘 '안기부 언론팀'부터 '삼성 로비'까지 담았다,"[창간 30주년 기획] 1995년 5월 창간호부터 5개월 치 지면 들춰보니 언론계 현실 고스란히 [미디어오늘 정철운 기자]  미디어오늘은 1995년 4월12일 창간준비호에서 “언론계 안팎의 고급 정보와 보도 비평 등을 주 내용으로 하는 주간 미디어 전문지”로 매체 성격을 규정한 뒤 “국민과 함께하는 언론 운동의 새로운 지평을 열어나갈 것”이라고 밝혔다. 미디어오늘은 언론노련 기관지 언론노보 기능을 확대 강화한 대중지로 주간 12면 체제로 출발했다. 창간준비호에 축사를 보낸 손석희 MBC 아나운서는 “누구나 자기 거울은 있는 법”이라며 “언론노련이 우리만의 거울을 모든 이들에게 보여주겠다고 나섰다. 우리들 혼자만의 은밀한 자괴심, 이 무거운 짐을 이제 벗어 놓아도 되는 것이라고 믿는다. 생각해 보면 그것은 우리가 늘 갈망해 오던 것”이라며 미디어오늘 탄생을 축하했다.  5월17일자 20면짜리 창간호엔 김영삼정부가 폐지를 약속했던 안기부 언론팀이 여전히 활동 중이라며 주요 언론사의 전담 기관원 이름을 1면에 공개했다. 이어 “대구 가스폭발 참사 때 이들 (안기부) 요원이 방송사에 대해 현장 참상을 축소하고 수습에 중점을 두도록 '보도 조정'을 한 사실이 방송기자들을 통해 알려지기도 했다”고 보도했다. 이형모 미디어오늘 발행인은 창간사에서 “우리가 오늘부터 향하고자 하는 곳은 언론의 심층”이라고 선언했다. 창간 기획으로 '신문자본 연구'와 '언론고시 이대로 좋은가'를 시작했다. 창간 특집으로 한길리서치에 의뢰해 언론학자 160명의 언론사 종합 평가를 내놨다. 신문사 종합평가 순위는 동아일보, 조선일보, 한겨레 순이었고 방송사는 KBS, MBC, SBS 순이었다. 뉴미디어 면에는 박형준 동아대 사회학과 교수(현 부산시장)가 <안녕, 마르크스… 컴퓨터는 지금 혁명 중>이란 기고를 실었다. 인물면엔 책 '김대중 죽이기'를 쓴 강준만 전북대 신문방송학과 교수 인터뷰를 담았다. 강준만은 자신의 언론비판을 가리켜 “밥벌이에 대한 최소한의 예의”라고 말했다. 인터뷰 하단에는 이 책에 대한 김대중 조선일보 주필의 반응이 실렸는데 김 주필은 미디어오늘에 “조선일보의 김대중을 죽이기 위해 쓰여진 게 아닌가 하는 의심이 들었다”고 말했다. 5월24일자에선 신문판촉 경쟁 조사에 나선 공정거래위 사무처장을 인터뷰했다. 노광선 기자는 '오보 이야기' 연재를 시작했다. 첫 편은 “안보상업주의 시초”로 평가한 조선일보의 1968년 '공산당이 싫어요' 보도였다. 5월31일자에선 한국통신과 현대자동차를 사례로 노사분규 보도의 문제를 다뤘다. 6월14일자에선 대구YMCA가 KBS의 대구 가스 참사 축소 보도로 알권리가 침해되었다며 국가와 KBS를 상대로 1억 원의 손해배상 청구에 나선 소식을 1면 톱으로 다뤘다. 그해 7월 신문부수공사제도(ABC제도) 시행을 앞두고 “공사 실시로 진정한 권위지가 가려질 것”이라는 조용중 ABC협회장 인터뷰도 실렸다. 뉴미디어면에서는 미국 USA투데이 인터넷판을 가리켜 “15분마다 기사가 교체된다”고 보도했다.  6월28일자 1면 톱에선 삼성중공업 직원들이 기아자동차 신형 봉고차 등을 촬영하다 붙잡히자 삼성그룹 차원에서 대대적인 로비를 벌여 보도를 막으려 한 사실이 확인됐다고 보도했다. 이 문제를 처음 보도한 연합통신 기사가 사라지고 타 신문사도 초판에 실렸던 기사가 삭제되거나 축소됐다. 이를 두고 당시 송희영 조선일보 경제부장은 “삼성 홍보실에서 로비를 했던 게 사실”이라고 밝혔다. 미디어오늘은 이어진 3면에서 삼성의 '대언론 로비' 실상을 다뤘는데, 일부 기자들은 삼성 비판 기사를 출고한 뒤 호출기(삐삐)를 끄고 삼성을 피하고 있었다. 11면에선 중앙일보가 언론사 최초로 수습기자들에게 유격훈련을 실시해 논란이 일고 있다고 전했다. 중앙일보 기자들은 “군사문화 주입을 연상시키는 훈련을 납득하기 힘들다”고 했다. 보도 이후 유격훈련은 사라졌다. 인물면에선 김행 중앙일보 조사 전문기자를 인터뷰했다. 김행은 “전문기자의 최고 덕목은 정확·심층성”이라고 했다. 7월5일자에선 김대중 전 민주당 대선후보가 그해 5월31일 조선일보 방상훈 사장을 극비리에 만났다고 보도했다. 7월12일자에선 삼풍백화점 붕괴 참사 이후 “경쟁적 취재로 구조활동에 방해가 되고 있다”며 재난 공동 취재 체계를 갖춰야 한다는 언론계 내부 목소리를 전했다. 정보통신윤리위원회 고위관계자를 취재해 안기부가 PC통신을 사실상 검열하고 있다고 우려하는 기사도 볼 수 있었다. 7월19일자에선 조선일보가 6·27 지방선거 이후 김영삼 대통령을 강하게 비판하는 반면 김대중 전 후보에 대한 비판은 상대적으로 부족하다고 전하며 “조선 특유의 상업적 시류타기”라는 정치부 기자들 분석을 전했다. 7월26일자에선 이원종 청와대 정무수석이 방송3사 사장을 불러 지자체 선거 및 삼풍사건 보도에 강하게 불만을 표시하고 일부 보도 협조를 요청했다고 비판적으로 보도했다. 문화일보가 노조를 결성하자 대규모 보복인사로 '현대식' 탄압이 이어졌다고 소식도 전했다. 8월2일자에선 삼풍참사 언론보도가 속보 경쟁에 따른 오보에 생존자 영웅 만들기에 들떠 실종자와 부상자의 아픔을 외면했다고 비평했다. 8월16일자에선 '해방 50년 언론 50년' 기획을 통해 신문의 일본 잔재와 방송계의 일본 프로그램 모방 실태를 짚었다. 김영삼 대통령 차남 현철씨가 '언론 성역'이라며 그의 정치개입 문제와 취재기자들의 어려움을 전했다. 8월23일자에선 KBS 스포츠부장이 돈 봉투를 가져오지 않을 경우 특정 스포츠 행사에 비판 기사를 지시하고 돈 봉투를 가져오면 확대 미화 보도를 지시했다는 내부 폭로를 보도했다. MBC에선 안기부 MBC 담당 직원이 PD수첩 '조총련의 오늘'편을 녹화 중이던 스튜디오로 들어와 제작 과정을 지켜봤다며 사전 검열 시도를 비판적으로 다뤘다. 8월30일자에선 집회 취재 중이던 중앙일보 기자 등 사진기자 4명을 경찰이 집단 폭행했다며 관련 사진을 1면에 배치하고 “전경들은 중앙 기자가 실신해 쓰러지자 사과탄까지 터뜨리고 달아났다”고 비판했다. 10면에선 김병관 동아일보 회장의 장남 김재호씨가 동아일보에 입사했다고 보도했다. 한 동아일보 기자는 미디어오늘에 “앞으로 결재를 맡아야 될지도 모를 사람을 아랫사람으로 두고 어떻게 일할지 솔직히 걱정된다”고 털어놨다.  9월6일자에선 “방우영 조선일보 회장이 박정희 전두환 노태우 전직 대통령의 언론관과 언론정책을 강도 높게 비판하고 나서 언론계 안팎의 관심을 모으고 있다”고 보도했다. 당시 방 회장은 조선일보 사보를 통해 전두환씨가 세무조사를 하겠다고 “저질 협박”을 했다고 밝혀 파문이 컸다. 6면에서는 이례적으로 방 회장이 사보에 쓴 글의 전문을 실었다. 해당 글에서 방 회장은 박정희를 두고 “생리적으로 언론을 기피하고 혐오한 사람”이라 묘사했다. 전두환에 대해선 “그에게는 언론을 통제하고 탄압하는 길 밖에 달리 선택의 여지가 없었다”고 회상했다. 9월13일자에선 “법률상 금지돼있는 카드대출이나 선원모집 광고가 신문에 버젓이 게재되고 있다”며 “신문 광고가 불법행위를 조장하고 있다”고 우려했다. 이날 2면 기사에선 “문화일보가 실질적 사주인 정몽준 회장의 모교인 중앙고 교장의 퇴임 인터뷰를 사회면 기사로 처리, 기획의도를 놓고 뒷말이 무성하다”며 “기자들은 일부 편집국 간부의 빗나간 충성심에 의혹의 눈초리를 던지고 있다”고 전했다.  9월27일자에선 김대중 새정치국민회의 총재와의 단독 인터뷰가 실렸다. 김대중 총재는 “왜 창당할 수밖에 없는지 언론에 소상히 설명했지만 우리의 입장은 국민들에게 거의 전달되지 않았다. 세무조사로 언론사의 목을 죄고 있고 청와대가 때로는 압력을 넣고 때로는 간청을 하면서 간섭하니 언론이 위축될 수밖에 없다”고 했다. 그러면서 “언론에 의해 피해를 입어 왔다고 생각하지만 언론 자유가 침해당할 땐 앞장서서 싸워왔다”며 “KBS MBC 방송사 사장 임명 과정에 권력이 개입을 해선 안 될 것”이라고 말했다. 이날 1면에선 십 수명의 자동차 담당 기자들이 현대 대우 기아 등 3사의 전액 지원을 받아 유럽 현지 공장 등을 견학해 외유성이라는 지적을 받고 있다고 보도했다. 이와 관련해 “지난 7월 독일에서 현대 대우 기아차의 안전도가 지극히 위험하다는 실험 평가가 발표됐으나 우리 언론엔 이 사실이 단 한 줄도 보도되지 않았다. 언뜻 무관해 보이는 두 사건 사이에 어떤 함수관계는 없는 걸일까”라고 물었다.",2025. 5. 17. 14:05,http://v.daum.net/v/20250517140551319
[유미's 픽] 이재용 SW 키즈 양성 맡은 '이곳'…삼성SDS 지분 확대로 역할 더 커질까,"(지디넷코리아=장유미 기자)""소프트웨어(SW) 인재 양성은 IT 생태계 저변 확대를 위해 필수적입니다. 어렵더라도 미래를 위해 지금 씨앗을 심어야 합니다. 더 큰 꿈을 실현할 수 있도록 다 같이 도전합시다."" 지난 2019년 8월. 삼성청년SW아카데미(Samsung Software Academy For Youth, SSAFY) 광주캠퍼스를 방문한 이재용 삼성전자 회장은 교육생들에게 이처럼 강조하며 SW 젊은 인재 양성에 더 힘을 실을 것이란 의지를 드러냈다. SSAFY는 삼성의 SW 인재 양성 프로그램이다. 이 회장은 평소 '동행' 비전을 실천하며 청년 일자리 창출과 인재 육성에 앞장서 왔다. 글로벌 경기 침체로 어려운 경영환경 속에서도 SAFFY에 대한 지원은 아낌없이 이어갔다. 그 결과 지난 2018년 12월 1기 교육을 시작으로 최근 10기까지 SSAFY에서 배출된 수료자 수는 총 8천여 명으로, 취업률은 84%(약 6천700명)에 달했다. 이 회장은 지난 3월 20일 이재명 더불어민주당 대선후보를 만날 때도 장소를 서울 강남구 멀티캠퍼스 역삼 SSAFY 서울캠퍼스로 택했다. 두 사람이 공식적으로 처음 만난 곳을 이곳으로 정한 것은 청년 취업 지원에 대한 양측의 마음이 통한 덕분이다. 이 자리에서도 이 회장은 ""SAFFY는 삼성 소프트웨어 역량을 키워 사회와의 동행을 위한 프로그램""이라며 ""대한민국의 미래인 우리 청년들을 위해 투자한다는 믿음으로 끌고 왔다""고 강조했다. 이에 이 대표는 ""우리가 살아왔던 시대와 달리 요즘 청년들이 기회를 찾기가 힘든 것 같다""며 ""이들이 새로운 기회를 찾을 수 있도록 삼성이 역량을 쏟아주고 계신 데 깊이 감사드린다""고 화답했다.  소프트웨어(SW) 인재 양성이 국가적·산업적으로 중요한 상황에서 두 사람의 만남 이후 삼성은 최근 들어 교육 사업에 힘을 싣는 분위기다. 삼성SDS가 자회사인 멀티캠퍼스의 보유 지분을 늘리며 본격적으로 교육 사업을 키우기 위해 나섰기 때문이다. 17일 금융감독원 전자공시시스템에 따르면 삼성SDS는 오는 6월 2일 삼성글로벌리서치로부터 멀티캠퍼스 지분 15.16%를 매입키로 했다고 지난달 30일 공시했다. 당시 종가에서 20% 할증된 가격에 거래가 진행될 예정으로, 총 거래규모는 351억4천500만원이 된다. 삼성그룹의 교육서비스 전문업체인 멀티캠퍼스는 지분 47.24%를 보유한 삼성SDS가 최대주주다. 삼성글로벌리서치는 15.16%로 2대 주주 자리를 유지했다. 이번에 지분 정리가 되면 삼성SDS의 지분은 62.4%로 높아진다. 업계에선 삼성SDS로 삼성그룹이 멀티캠퍼스 보유 지분을 일원화시킨 것이 삼성이 교육 사업 확대를 통해 청년 인재 양성에 좀 더 주력하겠다는 의지를 드러낸 것으로 봤다. 삼성SDS와 멀티캠퍼스는 이번 지분 확대를 두고 '책임경영 강화' 차원이라는 입장이다. 삼성SDS 관계자는 ""멀티캠퍼스도 성장을 통해 기업 가치를 제고하기 위해선 인공지능(AI)을 활용해 신사업을 추진하는 등의 움직임이 필요한 시기""라며 ""(이번 지분 취득으로) 우리의 IT 기술을 멀티캠퍼스가 더 잘 활용할 수 있게 될 것으로 보여 교육 사업을 확대하는 데도 도움이 될 것으로 보인다""고 말했다.  지난 1997년 사업을 시작한 삼성SDS 멀티캠퍼스는 기업 및 공공기관을 대상으로 직무역량 관련 오프라인, 이러닝 서비스 및 IT 소프트웨어 전문 인력 양성 교육서비스를 제공했다. 2000년에 삼성인력개발원 경제연구소에서 분사해 설립된 크레듀가 지난 2015년 삼성SDS 멀티캠퍼스 영업 양수를 완료한 후 이듬해 멀티캠퍼스로 사명을 변경하며 지금까지 유지하고 있다. 멀티캠퍼스는 현재 ▲기업 임직원을 대상으로 인재개발(HRD) 콘텐츠를 제공하는 기업교육 서비스 ▲기업과 공공기관의 채용·인사 고과에 적용하는 외국어 평가 서비스 등을 제공하고 있다. 지난 2006년에는 기업공개(IPO)를 추진해 코스닥 시장 상장에 성공했다. 특히 공모주 청약에서 2001년 이후 코스닥 공모로는 최대 규모인 3조3천400억원의 청약 자금이 몰려 주목을 받았다. 경쟁률은 710.8대 1을 기록했다. 또 멀티캠퍼스는 삼성뿐 아니라 다양한 대기업을 고객사로 둔 기업교육 전문업체로 지위를 유지하고 있다. 실제로 지난해 말 주요 매출처는 삼성전자, 대한상공회의소, 삼성SDS, 삼성생명보험, 삼성글로벌리서치로, 5곳이 총 매출액에서 차지하는 비중은 44.2%를 기록했다. 5곳에서 발생된 지난해 매출액은 1천560억7천300만원이다. 특히 이곳은 이 회장의 '동행' 철학이 묻어난 SSAFY 운영도 맡고 있다. 이와 관련한 지난해 계약 금액은 138억7천335만2천원으로, 전년 동기 대비 16.9% 증가했다. 하지만 전년과 달리 이 사업과 관련해 643만3천원의 손상차손이 발생했다. 서울대학교 K-디지털 교육(K-Digital Training, KDT) 프로그램에선 무려 매출이 86.5% 줄어든 2억654만5천원에 그친 데다 11만2천원을 손상차손으로 인식했다. 이에 대해 멀티캠퍼스 관계자는 ""보고서상 손상차손 금액은 내부 회계기준에 의거해 설정된 금액으로, 현재 매출채권에 대한 손상차손은 회수기일을 기준으로 회수 구간을 나눠 해당 구간별로 이를 차별적으로 반영 중""이라며 ""이로 인해 연도별로 대손충당금이 상이할 수 있는데 현재로선 매출채권은 모두 정상(으로 문제가 없다)""고 설명했다. 하지만 멀티캠퍼스의 지난해 실적은 다소 부진한 모습을 보였다. 이 기간 연결기준 영업이익은 전년 동기 대비 3.4% 하락한 389억2천884만원, 매출액은 1.6% 감소한 3천527억3천951만원으로 나타났다. 영업이익은 2022년 410억4천229만원을 기록한 후 매년 하락세를 기록 중이다. 올해 1분기 실적은 더 큰 폭의 감소세를 보였다. 매출액은 1년 새 8.8% 줄어든 699억9천9981만원, 영업이익은 지난해 같은 기간보다 35.9% 하락한 38억4천179만원에 그쳤다. 당기순이익도 28.2% 줄어든 37억765만원으로 집계됐다. 이에 대해 멀티캠퍼스 관계자는 ""경기위축에 따른 공공기관 및 기업의 예산축소 기조 유지, 동종기업간 경쟁심화로 IT 교육, 정부지원 사업 등 교육 서비스 매출이 감소한 것이 주원인""이라고 말했다. 부진한 실적 때문에 주가도 신통치 않다. 멀티캠퍼스의 지난 16일 주가는 3만3천150원으로, 일주일 전에 비하면 3.21%, 1년 전에 비하면 5.96% 하락한 수치다. 업계 관계자는 ""모회사인 삼성SDS의 지분이 높아질 것이란 얘기에도 멀티캠퍼스 주가는 큰 빛을 발하지 못하고 있다""며 ""강력한 현금 창출 능력에도 불구하고 효율적인 자본 배분이 이뤄지지 않고 있는 데다 실적 부진의 늪에 빠진 것이 영향을 미친 것으로 보인다""고 분석했다. 그러면서 ""삼성SDS의 기업 가치를 확대하는 데 멀티캠퍼스의 성장도 필요하다는 시장의 시각도 있는 만큼, 삼성 측이 이번 지분 일원화를 통해 멀티캠퍼스를 어떻게 활용할 지 기대된다""며 ""특히 국내 SW 인재 부족 현상이 심화되고 있는 만큼 삼성SDS가 멀티캠퍼스를 통해 SW 인재 양성에 이전보다 더 적극 나설 지 주목된다""고 덧붙였다. 장유미 기자(sweet@zdnet.co.kr)",2025. 5. 17. 09:00,http://v.daum.net/v/20250517090015834
"삼성은 수익, 한화는 CSM…실적 엇갈리자 전략도 차이", ,2025. 5. 17. 06:01,http://v.daum.net/v/20250517060122782
"[속보] 5-0 못 지킨 삼성, 강민호 부상까지 겹쳤다…""왼쪽 무릎 뒤틀림 통증"" (부산 현장)"," (엑스포츠뉴스 부산, 김지수 기자) 삼성 라이온즈가 5점의 리드를 지키지 못하고 무너졌다. 설상가상으로 주전 포수 강민호까지 경기 중 부상을 당하는 악재까지 겹쳤다. 삼성은 17일 부산 사직야구장에서 열린 2025 신한 SOL Bank KBO리그 롯데 자이언츠와의 팀 간 4차전 및 더블헤더 1차전에서 5-7로 졌다. 지난 15일 포항에서 KT 위즈를 13-0으로 완파한 기세를 이어가지 못했다. 삼성은 이날 게임 초반 순조로운 스타트를 뗐다. 2회초 캡틴 구자욱의 선제 1타점 2루타, 김성윤의 2타점 2루타가 터지면서 3-0 리드를 잡고 기분 좋게 출발했다. 삼성 타선은 3회초에도 1사 2루에서 이성규의 1타점 2루타가 터지면서 공격의 고삐를 늦추지 않았다. 이성규는 5회초 1사 3루에서 1타점 외야 희생 플라이를 기록, 멀티 타점을 기록했다.  삼성 선발투수 데니 레예스도 힘을 냈다. 5회까지 롯데 타선을 무실점으로 봉쇄하고 좋은 흐름을 이어갔다. 점수 차와 남은 이닝을 고려하면 삼성의 낙승이 예상됐다. 하지만 삼성은 호투하던 레예스가 6회초 선두타자 장두성, 고승민에게 연속 안타를 맞고 무사 1·3루 위기에 몰리면서 흐름이 묘해졌다. 레예스가 곧바로 빅터 레이예스에게 3점 홈런을 허용하면서 순식간에 여유 있던 점수 차가 5-3으로 좁혀졌다. 삼성 벤치는 불펜을 가동, 롯데의 추격 흐름을 끊으려고 했다. 하지만 김태훈이 전준우에게 2루타, 정훈에게 내야 안타를 내주면서 무사 1·3루 위기가 계속됐다. 김태훈이 일단 윤동희에게 내야 땅볼을 유도, 아웃 카운트를 늘리는 듯했지만 유격수 이재현의 2루 송구 실책으로 1루 주자와 타자 주자가 모두 세이프, 3루 주자의 득점으로 스코어는 5-4가 됐다. 무사 1·2루 위기도 이어졌다.  삼성 벤치는 베테랑 좌완 백정현으로 투수를 교체했지만 롯데의 기세를 꺾지 못했다. 백정현이 1사 만루에서 대타 전민재에게 1타점 외야 희생 플라이를 내주면서 5-5 동점이 됐다. 삼성은 설상가상으로 8회말 수비 때 역전까지 당했다. 김재윤이 2사 후 전민재를 중전 안타로 1루에 내보낸 뒤 좌완 이승민으로 투수를 교체했지만 악수가 됐다. 이승민이 장두성, 고승민에게 연속 볼넷을 내줘 2사 만루 위기를 자초했다. 삼성은 고승민의 볼넷 출루 때 포수 강민호가 스트라이크 존을 크게 벗어난 이승민의 공을 잡으려는 과정에서 부상까지 당했다. 강민호는 김재성과 교체돼 더블헤더 1차전을 마칠 수밖에 없었다. 삼성은 이 고비를 넘기지 못했다. 이승민이 레이예스에게 2타점 적시타를 맞으면서 스코어가 5-7로 뒤집혔다. 9회초 정규이닝 마지막 공격에서 타선이 무득점에 그치며 역전패로 무릎을 꿇었다.  더블헤더 1차전에서 통증을 호소하며 교체됐던 강민호는 2차전 선발 라인업에서 제외됐다. 삼성 구단은 강민호의 정밀 검진이 가능한 병원을 물색 중이다. 삼성 구단은 ""강민호는 더블헤더 1차전 수비 과정에서 왼쪽 무릎 뒤틀림 발생으로 인한 통증을 느꼈다""며 ""현재 아이싱 치료 중으로 추후 병원 검진 예정이다""라고 밝혔다. 한편 삼성은 이날 오후 6시 20분부터 열리는 더블헤더 2차전에 구자욱(지명타자)-김성윤(중견수)-류지혁(2루수)-르윈 디아즈(1루수)-이성규(우익수)-김헌곤(좌익수)-김영웅(3루수)-김재성(포수)-이재현(유격수)로 선발 라인업을 구성했다. 선발투수는 베테랑 우완 최원태가 출격한다. 사진=엑스포츠뉴스 DB 김지수 기자 jisoo@xportsnews.com",2025. 5. 17. 18:21,http://v.daum.net/v/20250517182141274
"2주 연속 토요일 더블헤더 삼성라이온즈…돔구장도 아닌데, 상대적 많은 경기 치러"," 이번 시즌 처음으로 KBO리그 5경기가 모두 비 때문에 취소된 가운데 삼성라이온즈는 지난주 토요일에 이어 2주 연속 더블헤더 포함 3연전을 치르는 빡빡한 일정을 소화합니다. 16일 예정됐던 2025 신한 SOL 뱅크 KBO리그 주말 3연전 첫 경기는 사직에서 예정된 롯데자이언츠와 삼성의 클래식시리즈 포함, 잠실과 광주, 대전과 울산까지 5경기가 모두 비로 취소됐습니다. 이번 시즌 리그 모든 경기가 취소된 건 지난 4월 1일 주중 3연전 첫 경기가 그보다 앞선 주말에 창원NC파크에서 발생한 사고로 인해 멈춘 이후 2번째이며 날씨로 인한 5경기 취소는 처음입니다. 지난주 금요일 역시 전국에 많은 비가 내려 대구에서 펼쳐질 예정이던 LG트윈스와 삼성의 경기를 시작으로 잠실과 문학, 수원 경기는 다음날 더블헤더로 밀렸지만, 돔구장을 쓰는 키움히어로즈와 한화이글스의 고척스카이돔 맞대결은 펼쳐졌고, 이 경기에서 26년 만에 한화의 10연승이라는 대기록이 함께 했습니다. 이번 봄 주말에 비가 자주 이어지며 지난 주말에는 대구삼성라이온즈파크만 토요일 더블헤더로 경기를 소화했고, 나머지 경기인 NC와 두산의 잠실경기와 KIA와 SSG의 문학 맞대결, 롯데와 KT의 수원 경기는 모두 더블헤더 1차전이 취소되면서 일요일 더블헤더로 펼쳐졌습니다. 토요일 더블헤더를 치른 삼성은 비록 일요일 더블헤더를 소화한 다른 3곳과 다르게 1경기만 치렀지만, 당시 LG와의 홈 3연전을 모두 내주며 2연속 스윕패의 아픔을 당합니다.  시즌 초반 부상 선수들이 많았던 삼성은 상대적으로 우천 취소가 적은 대구의 특성과 함께 3연전을 온전히 치르지 못한 경우는 타팀보다 적습니다. 지금까지 44경기를 치른 삼성은 고척돔을 쓰면서 홈경기 취소가 없는 키움이 소화한 46경기와 이번 주말 경기 전까지 홈 우천 취소는 한 번이었던 롯데의 45경기에 이어 3번째로 많은 수준이며, 삼성과 같은 기록은 KT뿐입니다. 정상적으로 토요일 5경기가 모두 치러지면, 삼성은 리그에서 LG와 함께 2주 연속 주말 3연전을 더블헤더 포함, 모두 소화한 팀이 됩니다. 포항 원정에서 위닝시리즈로 5월 초반 하락세에서 반등을 보여준 삼성이 부산 원정을 어떻게 마무리할지 여부는 초반 순위 싸움에 주요한 요소로 작용할 전망입니다. (사진 제공 삼성라이온즈)",2025. 5. 17. 08:42,http://v.daum.net/v/20250517084204557
