title,content,date,url
"삼성생명, 1분기 당기순이익 6353억원…전년比 2.1% 증가"," 16일 삼성생명은 기업설명회(IR)를 1분기 매출은 6조3272억원으로 작년 동기 대비 4.1%, 영업이익은 7539억원으로 1.0% 증가했다고 밝혔다. 보험손익은 보험계약마진(CSM) 상각익 증가와 예실차 개선에 힙입어 2779억원으로, 작년 동기 대비 3.6% 늘어났다. 투자손익도 5630억원으로 전년 동기 대비 0.4% 증가했다. 1분기 신계약 CSM은 6578억원으로 23.3% 감소했다. 신계약 CSM 내 건강보험 비중은 74%까지 확대했다. 삼성생명은 다양한 건강상품과 담보 공급에 주력한 결과, 지난해 생보업계 최다 배타적 사용권을 획득했다고 설명했다. 삼성생명은 올해 업계 최초로 중입자 방사선 치료 특약을 출시하기도 했다. 삼성생명 전속 설계사수는 업계 최대 수준인 3만9350명이라고 설명했다. 전속채널의 건강상품 판매비중은 78%에 달한다. 한편, 이날 컨퍼런스콜에서 삼성생명은 메리츠화재가 제기한 장기보험 예상 손해율 가정 논란에 대한 입장을 제기하기도 했다. 이날 변인철 삼성생명 계리팀장(상무)는 “IFRS17에서 예실차는 0%에 가도록 평가하는 것이 원칙이고, 이에 따라 예실차가 0%에 가깝게 추정해 부채를 평가하는게 바람직하다고 생각한다”고 밝혔다. 앞서 김용범 메리츠금융지주 부회장은 14일 자사 컨퍼런스콜을 통해 “회사 간 실적손해율은 유사한데, 예상손해율의 추세는 완전히 반대인 경우가 확인된다”며 “현재 실적손해율보다 예상손해율을 현저히 낮게 가정한 회사도 보인다”며 타 보험사의 회계 방식에 대해 목소리를 냈다.",2025. 5. 16. 15:51,http://v.daum.net/v/20250516155103429
"키키 하음, 25일 데뷔 첫 시구 출격… 삼성 라이온즈 '승리 요정' 변신"," [티브이데일리 한서율 인턴기자] 그룹 키키(KiiiKiii) 멤버 하음이 삼성 라이온즈 마운드에 오른다. 지난 16일 삼성 라이온즈는 공식 인스타그램을 통해 오는 25일 오후 2시 대구 삼성 라이온즈 파크에서 열리는 '2025 KBO 리그' 정규 시즌 기아 타이거즈와의 홈경기에서 삼성 라이온즈의 최강삼성 승리 기원 스페셜 시구자로 키키 멤버 하음을 선정했다. 하음은 소속사 스타쉽엔터테인먼트를 통해 ""데뷔 후 첫 시구를 삼성 라이온즈에서 할 수 있게 돼 너무 영광이다. 저희 키키의 팀명처럼 모든 관객분들과 선수분들에게 밝고 긍정적인 에너지를 드릴 수 있었으면 좋겠다. 올해 시즌 끝까지 선수분들 모두 다치지 말고 힘내시라. 25일에 만나겠다""라고 소감을 전했다. 하음은 유니크하고 몽환적인 음색으로 키키 노래의 강렬한 인상을 심어주는 멤버다. 귀엽게 올라간 눈매와 매력적인 페이스로 모델 겸 배우인 데본 아오키를 떠올린다는 평을 받으며 팬들의 사랑을 받고 있다. 각양각색으로 변화하는 콘셉트와 메이크업을 완벽하게 소화, 자체 콘텐츠를 비롯한 다양한 콘텐츠에서 독보적인 비주얼을 보여주기도 했다. 한편 키키는 지난 3월 24일 발매된 데뷔 앨범 '언컷 젬(UNCUT GEM)' 활동을 통해 멤버들의 실력과 비주얼은 물론 폭넓은 음악적 스펙트럼과 팀의 색깔을 보여줬다. 지난달 5일 데뷔곡 '아이 두 미(I DO ME)'로 MBC 음악 프로그램 '쇼!음악중심'에서 첫 지상파 음악방송 1위에 올랐으며 신인 아이돌그룹 브랜드평판에서 3개월 연속 1위에 랭크 중이다. [티브이데일리 한서율 인턴기자 news@tvdaily.co.kr / 사진제공= 삼성 라이온즈, 스타쉽엔터테인먼트] 키키 | 하음 [ Copyright ⓒ * 세계속에 新한류를 * 연예전문 온라인미디어 티브이데일리 (www.tvdaily.co.kr) / 무단전재 및 재배포금지 ]",2025. 5. 17. 17:20,http://v.daum.net/v/20250517172011290
"삼성SDS, ‘범정부 초거대AI 공통기반 구현’ 사업 수주"," 16일 조달청 나라장터에 따르면 지난 15일 개찰된 이번 사업에서 삼성SDS 컨소시엄은 종합평점 99.9906점을 획득헀다. 2위는 98.5점을 받은 LG CNS 컨소시엄이, 3위는 96.6907점을 얻은 KT 컨소시엄이었다. 이와 관련해 삼성SDS 컨소시엄은 AI기술력을 집중 검토하는 전문평가 부문에서 경쟁사 대비 우수한 평가를 받았다. 해당 컨소시엄에는 삼성SDS를 주축으로 네이버클라우드, 세림티에스지, 투이컨설팅이 참여하고 있다. 한편 범정부 초거대AI 공통기반 구현 사업은 범부처 공무원이 보안 걱정 없이 다양한 생성형 AI 서비스를 활용할 수 있는 기반을 마련하기 위한 국가 주도 프로젝트로, 정부·지자체가 AI 서비스를 기획하고 구현하고자 할 때 공통적으로 활용하는 AI 컴퓨팅 장비, 공통데이터, 개발·운영환경 등 AI 자원 전반을 제공하는 것을 목적으로 한다. 배정된 사업 예산은 90억원이다. 삼성SDS는 대구 민관협력형(PPP)센터 삼성클라우드플랫폼(SCP) 존에서 생성형 AI 서비스 플랫폼 ‘패브릭스’를 서비스형 소프트웨어(SaaS)로 제공하며, 컨소시엄사·파트너사와 협력해 성공적으로 사업을 수행하겠다는 계획이다. 한편 삼성SDS는 최근 행정안전부의 ‘지능형 업무관리 플랫폼 구축’ 사업의 우선 협상 대상자로 선정된 바 있다.",2025. 5. 16. 15:51,http://v.daum.net/v/20250516155107438
"삼성스토어, ‘데이코 위크’ 실시… “프리미엄한 당신을 위한 최고의 선택”"," 삼성전자의 럭셔리 빌트인 가전 브랜드 ‘데이코(Dacor)’가 5월 16일부터 6월 2일까지 최초로 ‘데이코 위크’를 진행한다. 이번 행사는 삼성스토어 내 데이코 매장 16개 점과 데이코 하우스(대치)를 포함해 총 17개 지점에서 운영된다. 행사 매장은 삼성스토어 ▲더현대 서울 ▲현대 목동 ▲현대 대구 ▲현대 무역 ▲현대 압구정 ▲현대 판교 ▲롯데 무역 ▲롯데 본점 ▲롯데 잠실 ▲신세계 강남 ▲신세계 광주 ▲신세계 대구 ▲신세계 대전 ▲신세계 본점 ▲신세계 센텀시티 ▲갤러리아 광교 ▲데이코 하우스(대치)다. 삼성스토어는 데이코 위크 기간 동안 프리미엄 가전을 찾는 고객에게 만족도 높은 쇼핑 경험을 제공하기 위해 다양한 프로모션을 마련했다. 먼저, 데이코 제품과 삼성 TV 또는 시스템에어컨 행사모델을 동시에 구매할 경우 TV는 8.5%, 시스템에어컨은 실내기 한 대당 10만원의 할인 혜택을 제공한다. 또한, 데이코 제품을 포함해 총 3천만 원 이상 구매한 고객에게는 에르메스 바디케어 세트 또는 빌레로이앤보흐 식기 세트를 사은품으로 증정한다. 이와 함께, 1천만 원부터 5천만 원까지 구매 금액에 따라 최대 50만 원 상당의 상품권이 제공된다. 이외에도, 온라인 예약 후 매장을 방문해 상담을 받은 고객에게는 데이코 프리미엄 우산을, SNS 인증 이벤트에 참여한 고객에게는 데이코 굿즈 키링을 증정한다. 삼성전자판매 상품전략 2팀 김태수 상무는 “데이코는 성능과 디자인을 모두 갖춘 프리미엄 빌트인 가전 브랜드로, 고객의 공간에 품격을 더하는 최고의 솔루션”이라며, “이번 데이코 위크는 제품 체험부터 실질적인 혜택까지 모두 누릴 수 있는 기회가 될 것”이라고 밝혔다. - Copyright ⓒ 조선비즈 & Chosun.com -",2025. 5. 16. 16:35,http://v.daum.net/v/20250516163555222
"키키 하음, 25일 삼성 라이온즈 시구자 등판..‘승리 요정’ 도전 [공식]"," [OSEN=김채연 기자] 그룹 키키(KiiiKiii)의 하음이 삼성 라이온즈 마운드에 오른다. 지난 16일 삼성 라이온즈는 공식 인스타그램을 통해 오는 25일(일) 오후 2시 대구 삼성 라이온즈 파크에서 열리는 '2025 KBO 리그' 정규 시즌 기아 타이거즈와의 홈경기에서 삼성 라이온즈의 최강삼성 승리 기원 스페셜 시구자로 키키 멤버 하음을 선정했다. 하음은 소속사 스타쉽엔터테인먼트를 통해 ""데뷔 후 첫 시구를 삼성 라이온즈에서 초청해 주셔서 너무 영광이고, 저희 키키의 팀명처럼 모든 관객분들과 선수분들에게 밝고 긍정적인 에너지를 드릴 수 있었으면 좋겠습니다. 올해 시즌 끝까지 선수분들 모두 다치지 말고 화이팅입니다! 25일에 만나요!""라고 소감을 전했다.  하음은 유니크하고 몽환적인 음색으로 키키 노래의 강렬한 인상을 심어주고 있으며, 귀엽게 올라간 눈매와 매력적인 페이스로 모델 겸 배우인 데본 아오키를 떠올린다는 평을 받으며 이목을 끌고 있다. 각양각색으로 변화하는 콘셉트와 메이크업을 완벽하게 소화, 자체 콘텐츠를 비롯한 다양한 콘텐츠에서 독보적인 비주얼을 보여주며 연일 화제에 올랐고, 차세대 '트렌드 아이콘'으로 떠올랐다. 한편, 하음이 멤버로 속한 키키는 지난 3월 24일 발매된 데뷔 앨범 'UNCUT GEM(언컷 젬)' 활동을 통해 멤버들의 실력과 비주얼은 물론, 한계 없는 음악적 스펙트럼과 팀의 색깔을 보여주며 2025년을 물들일 '젠지미 신예'로 떠올랐다. 지난달 5일 데뷔곡 'I DO ME(아이 두 미)'로 MBC '쇼!음악중심'에서 첫 지상파 음악방송 1위에 올랐으며, 신인 아이돌그룹 브랜드평판에서 3개월 연속 1위에 랭크 중이다. /cykim@osen.co.kr [사진] 삼성 라이온즈, 스타쉽엔터테인먼트",2025. 5. 17. 16:57,http://v.daum.net/v/20250517165721728
"금감원, 무역금융펀드 판매 삼성증권에 '기관경고' 제재"," [서울=뉴시스]우연수 기자 = 금융감독원이 코로나19 당시 무역 영업 불황으로 정상 환매되지 못한 TA무역금융펀드 판매와 관련해 삼성증권에 기관경고 제재를 내렸다. 16일 금융당국에 따르면 금감원은 삼성증권에 기관경고과 임직원 정직 3개월 등 제재를 내렸다. 삼성증권은 2018년 TA아시아무역금융펀드에 투자하는 특정금전신탁 상품을 출시하고 이를 판매하는 과정에서 투자자가 오인할 소지가 있는 내용을 판매 자료에 기재하고 영업점 직원들이 투자 권유시 이를 사용하도록 했다. 해당 신탁상품은 홍콩 소재 해외자산운용사인 트랜스아시아(TA)가 무역금융 대출채권을 기초자산으로 운용하는 무역금융펀드에 투자하거나 해당 펀드를 편입한 사모펀드에 재간접 투자하는 구조다. 만기시 수입업체로부터 매출채권의 총 금액을 지급받는 거래 구조로 수입업체의 신용위험에 대한 안전장치로 '신용보험'이 있었는데, 삼성증권은 해당 상품에 대해 신용보험을 통한 원금회수가 확실하다고 오인할 만한 내용으로 투자를 권유한 사실이 있다. '사고 발생시 보험이 약 85~90% 이상 커버 가능' 문구 등을 추가 기재하기도 했다. 삼성증권은 손실을 본 고객들에 대해 원금의 80% 보상 조치를 진행했다. 당시 상품에 투자한 고객들은 원금의 약 20~30% 수준의 투자금만 회수해 원화 기준으로 원금 수준을 회복한 상황이다. 한편 금감원은 무역금융펀드와 관련해 지난 2021년 신한투자증권에 영업정지 6개월, 올해 4월 한국투자증권에 기관경고 제재를 내린 바 있다. ☞공감언론 뉴시스 coincidence@newsis.com",2025. 5. 16. 17:36,http://v.daum.net/v/20250516173613708
"[단독] TV 점유율 줄고 LCD패널값↑…삼성, 경쟁력 강화 특단 대책","글로벌 TV시장의 최강자가 일본 소니에서 삼성전자로 바뀐 건 2006년이었다. 세련된 디자인과 압도적인 성능을 겸비한 ‘보르도 TV’가 전 세계적으로 돌풍을 일으킨 덕분이었다. 일본보다 발 빠르게 LCD, PDP 등 ‘벽걸이 TV’ 시대를 연 삼성에 맞설 만한 적수는 없었다. 그때만 해도 중국의 기술력은 삼성에 비할 바가 아니었다. 글로벌 TV시장에서 ‘삼성 천하’에 균열이 생기기 시작한 건 2020년대 들어서면서다. 가격으로만 승부하던 TCL, 하이센스 등 중국 업체가 기술을 확보하면서 동남아시아 등 개발도상국은 물론 미국 유럽 등 선진국 시장도 갉아먹기 시작한 것. 여기에 글로벌 LCD 패널 시장을 접수한 중국 디스플레이 업체들이 가격을 올리기 시작하자 19년째 글로벌 TV 시장 1위 자리를 지켜온 삼성전자도 코너에 몰리게 됐다. 삼성전자 영상디스플레이(VD)사업부가 처음으로 ‘비상경영’을 선언한 배경이다. ◇선제 대응 나선 삼성 TV  삼성전자 VD사업부가 비상경영에 들어간 건 2022년 스마트폰, 가전, TV를 아우르는 디바이스경험(DX) 부문이 시행한 비상경영과는 결이 다르다. 당시엔 삼성전자 DX부문의 재무파트가 중심이 돼 전반적인 비용 절감에 들어갔다면, 이번에는 VD 사업부장의 판단으로 TV 사업 전반의 경쟁력 재점검과 효율화 방안 찾기에 나섰다는 이유에서다. 글로벌 TV 시장의 ‘넘사벽’이던 삼성전자가 현 상황을 ‘위기’로 규정한 데는 이유가 있다. 점점 거세지는 중국의 공습에 제대로 대응하지 못하면 수년 내 글로벌 넘버원 자리를 내줄 수 있다고 봤기 때문이다. 글로벌 TV 시장 점유율이 모든 걸 말해준다. 삼성의 점유율은 2022년 19.6%에서 지난해 17.6%로 하락한 반면 TCL(11.7%→13.9%)과 하이센스(10.5%→12.3%)는 큰 폭으로 상승했다. 업계에선 삼성의 하락 곡선과 TCL 및 하이센스의 상승 곡선이 만나는 시점이 이르면 향후 3~4년이 될 것으로 예상하고 있다. 업계 관계자는 “중국의 기술력이 갈수록 높아지면서 중국 TV는 더 이상 저렴한 제품이 아니라 ‘싸고 좋은 제품’이란 인식이 확산하고 있다”며 “이대로 가다간 글로벌 1위 타이틀을 빼앗길 수 있다는 위기감에 삼성이 비상경영을 선언한 것”이라고 말했다. ◇패널 가격 상승도 위기 부추겨 VD사업부의 위기경영을 부른 또 다른 이유는 상승하는 LCD 패널 가격이다. 전 세계에서 판매되는 TV의 90%에 장착되는 LCD 가격은 계속 오르고 있다. 삼성전자의 지난해 패널 비용은 7조5825억원으로, 최근 3년 새 최고치를 기록했다. 삼성디스플레이와 LG디스플레이가 OLED로 전환하면서 LCD 시장을 완전히 장악한 중국 디스플레이 업체들이 공급량 조절에 나선 탓이다. 옴디아에 따르면 수요가 많은 65형 LCD TV 패널 가격은 지난해 12월 173달러에서 이달 178달러로 상승했다. 삼성은 대대적인 비용 절감과 함께 아직 중국과 격차가 있는 프리미엄 TV 판매를 늘려 대응한다는 전략을 세웠다. 회의·행사·소모품 등 비용을 줄이고 해외 출장을 최소화 할 계획이다. 원재료와 마케팅 등 각종 비용을 줄일 계획이다. 당장 TV 사업 정체를 돌파할 대책 마련이 쉽지 않은 만큼 불필요한 비용부터 줄이기로 한 것이다. 삼성은 아울러 LCD TV보다 단가가 높은 OLED TV 등 프리미엄 제품 판매를 늘리기로 했다. 용석우 VD사업부장(사장)은 지난달 신제품 출시 행사에서 “세계 경제의 불확실성 확대에도 OLED TV를 포함한 프리미엄 TV 시장은 계속 성장하고 있다”며 “앞으로 계속 비중을 확대해 나갈 것”이라고 말했다. 김채연/박의명 기자 why29@hankyung.com",2025. 5. 16. 17:56,http://v.daum.net/v/20250516175606426
