title,content,date,url
"""댕댕이·냥냥이와 식당 간다""…식약처, 식품위생법 개정안 입법예고","(지디넷코리아=김민아 기자)앞으로 개·고양이와 함께 음식점에 출입할 수 있게 된다. 식품의약품안전처는 음식점에 반려동물 출입을 허용하는 근거를 만들고 반려동물 동반출입 음식점의 위생·안전관리 기준 등을 신설하는 내용의 ‘식품위생법 시행규칙’ 일부개정안을 25일 입법예고했다. 개정안에는 ▲음식점 출입 가능한 반려동물의 범위(개·고양이) 및 영업장 시설기준 ▲영업장 위생·안전관리를 위한 영업자 준수사항 ▲위생·안전관리 기준 위반 시 행정처분 기준 신설 등이 담겼다.  다만 모든 음식점에 반려동물 출입이 가능해지는 것은 아니며 시설기준 등을 준수하고 희망하는 음식점에 적용된다. 음식점에 동반 출입할 수 있는 반려동물의 범위는 우리나라 반려동물의 대다수를 차지하고 예방접종률이 상대적으로 높은 개와 고양이로 한정된다. 영업자는 반려동물이 조리장, 식재료 보관창고 등 식품취급시설에 드나들 수 없도록 칸막이, 울타리 등 장치를 설치해야 한다. 영업장 출입구에 손을 소독할 수 있는 장치, 용품 등도 구비해야 한다. 영업장 입구에는 반려동물 동반 출입 가능 업소임을 게시해야 한다. 이 외에도 영업자는 ▲영업장 안에서 반려동물이 보호자에게서 벗어나 이동할 수 없다는 안내문 게시 ▲동물 전용 의자 또는 목줄 걸이 고정장치 설치 ▲접객용 식탁 간격 충분히 유지 ▲음식 진열·판매시 뚜껑 및 덮개 사용 ▲동물용 식기에 동물용 표시 ▲전용 쓰레기통 비치 등을 준수해야 한다. 반려동물의 식품취급시설 출입제한 및 영업장 이동 금지 의무를 위반한 영업자는 영업정지 처분을 받을 수 있다. 1차 위반시 영업정지 5일, 2차 위반과 3차 위반은 각각 영업정지 10일, 영업정지 20일 처분을 받는다. 식약처 관계자는 “이번 개정이 반려동물과 일상을 함께하는 반려인의 편의와 음식점 선택권을 보장하고 관련 산업 발전에 도움이 될 것으로 기대한다”고 말했다. 김민아 기자(jkim@zdnet.co.kr)",2025. 4. 25. 10:16,http://v.daum.net/v/20250425101620079
"신약 정보, 환자 '알권리'는 어디에…""식약처 명확한 해석 내놔야"""," 일부 다국적제약사가 전문의약품 광고를 의약전문지에만 할 수 있도록 한 규정을 지나치게 보수적으로 해석, 환자의 '알권리'를 침해하고 있다는 주장이 나온다. 국내에선 '약사법'에 따라 전문의약품 광고를 의약전문지에만 할 수 있도록 하고 있다. 일부 다국적제약사는 이를 근거로 일간지 기자의 기자간담회 참석을 제한하고 보도자료도 배포하지 않는 등 전문의약품 취재를 제한하고 있다. 신약에 대한 환자들의 관심이 커지는 상황에서 새로운 정보를 알릴 수 있는 기자간담회 참석까지 제한하는 것은 과도한 해석이란 지적이 나온다. 이에 보건당국이 관련 제도를 개선하고 명확한 해석을 내놔야 한다는 목소리가 커진다. 23일 제약업계에 따르면 최근 존슨앤드존슨의 제약부문 국내 법인인 한국얀센은 자사의 비소세포폐암 치료제 '리브리반트'(성분명 아미반타맙)의 병용요법 관련 기자간담회를 개최했다. 이 자리에서 이세훈 삼성서울병원 혈액종양내과 교수와 이기형 충북대병원 혈액종양내과 교수가 리브리반트의 임상적 의미를 설명했다. 리브리반트는 서로 다른 두 개의 항원을 인식해 결합하도록 설계된 이중특이적 항체다. 비소세포폐암을 일으키는 EGFR(상피세포성장인자수용체) 변이와 MET 변이를 표적하도록 면역세포를 지시해 종양 성장을 억제한다. 특히 미국에 처음 진출한 유한양행의 국산 항암 신약 '렉라자'(성분명 레이저티닙)와 비소세포폐암 1차 치료에 병용요법으로 쓰여 국내에서 환자와 투자자들의 관심을 많이 받는 약물이다. 렉라자와 리브리반트 병용요법이 기존 비소세포폐암 1차 표준치료법에 쓰이는 '오시머티닙' 단독요법 대비 사망위험을 25% 감소시키고 전체생존기간이 1년 이상 개선됐다는 연구결과가 나와 더 주목받았다. 그런데 한국얀센은 이런 리브리반트의 일간지 취재를 제한했다. 의약전문지에만 간담회 소식을 알리고 일간지들에는 요청이 있음에도 간담회 정보를 제공하지 않았다. 한국얀센 관계자는 ""원칙적으로 의약전문지 기자 대상으로만 기자간담회 초청장이 나가고 있다""며 ""일간지에 전문의약품 광고를 금지한 약사법 조항 때문""이라고 말했다. 약사법 제68조 6항은 △전문의약품 △전문의약품과 제형, 투여경로와 단위제형당 주성분의 함량이 같은 일반의약품 △원료의약품을 광고하지 못하도록 하고 있다. 다만 감염병 예방용 의약품과 의학·약학 전문가 등을 대상으로 하는 의약전문매체 대상 광고는 가능하다. 이를 보수적으로 해석해 일부 제약사들이 일간지 취재를 제한하는 것이다. 문제는 이런 점들이 환자들의 알 권리를 침해한다는 점이다. 미국의 경우 일반인을 대상으로 전문의약품 광고를 허용하며 환자들에 의약품의 효능과 부작용을 함께 알린다. 한 다국적 제약사 관계자는 ""해외에서는 환자를 위해 다양한 경로로 의약품을 설명하는데 한국은 언론에게조차 원활하게 정보를 공유하기 어렵다""고 지적했다. 식품의약품안전처가 명확한 지침을 내리지 않는 점도 문제다. 식약처는 '의약품광고 및 전문의약품 정보제공 가이드라인'에 ""객관적이고 입증 가능한 자료를 바탕으로 기업의 정상적인 활동의 일환으로 판단되는 보도자료 배포 행위만으로 의약품 광고에 해당하지 않는다""며 ""취재를 통한 기자의 보도기사는 약사법에 의한 광고로 판단하지 않고 있다""고 밝히고 있다. 하지만 기자간담회 등의 경우 모호한 입장을 취한다. 식약처 관계자는 본지에 전문의약품 기자간담회 관련 ""제공 정보 수준이 회사의 기업 활동 수준이라면 문제가 안 되겠지만 광고인지 정보 제공인지 개별 건으로 검토해서 판단할 사항""이라고 답했다. 업계 관계자는 ""식약처가 내놓은 의약품 광고 가이드라인 상 참고할 수 있는 사례가 부족하고 기업의 정상적 활동의 일환이라는 기준이 모호하다""며 ""환자의 알 권리와 정보 접근성 개선을 위해 식약처가 광고 가이드라인에 취재 행사 초청, 취재 지원 등 보다 구체적이고 명료한 사례와 기준을 추가하는 등으로 제도를 개선할 필요가 있다""고 말했다. 박미주 기자 beyond@mt.co.kr",2025. 4. 23. 17:01,http://v.daum.net/v/20250423170138392
비티진 ‘홍삼 특이 사포닌’ 혈압 조절 효과 국내 첫 식약처 인정," 홍삼의 특이 사포닌이 혈압 조절 및 심혈관 질환에 도움을 줄 수 있다는 연구 결과가 국내에서는 처음으로 식약처 인정을 받았다. 특이 사포닌 전문기업 비티진(대표 허율)은 자사의 ‘홍삼추출효소처리분말’이 식품의약품안전처로부터 ‘혈압 조절에 도움을 줄 수 있다’는 개별인정형 기능성을 인정받았다고 24일 밝혔다. 20여년의 끈질긴 R&D와 국내외 글로벌 연구 기관과의 공동임상 진행으로 독자개발에 성공한 것이다. 홍삼의 기능성으로는 면역력, 피로개선 등이 익숙하지만, 혈압 조절 목적의 기능성 인정은 국내외를 통틀어 비티진이 처음이다. 그동안 홍삼이 ‘혈압을 높인다’는 잘못된 속설을 비티진의 특이 사포닌이 ‘혈압을 낮출 수 있다’로 완전히 뒤집은 것이라 주목된다. 해당 원료의 핵심은 특이 사포닌 알지쓰리(Rg3)의 고함량에 있다. Rg3는 인삼에는 거의 없고 홍삼에만 극미량 함유하고 있는 홍삼의 핵심 지표 성분으로, 항고혈압, 항당뇨, 성기능 개선 등 다양한 약리 효능이 국내외 논문 등을 통해 보고 되고있지만, 과학적 유효성을 입증한 것은 비티진이 첫 사례라는 점에서 새로운 시장 가능성을 열었다는 평이다. 비티진은 특허 기술인 ECS(효소처리기술) 공법을 통해 특이 사포닌 Rg3 함량을 10% 이상 끌어 올려 체내 흡수율을 높였다. 이는 일반 홍삼 대비 약 300배 높은 수치다. 비티진 오진환 연구소장은 “이 성분은 체내에서 혈관 내피 세포의 산화질소(NO) 생성을 촉진해 혈관을 이완시키고 혈압을 낮추는 작용기전을 갖는다”면서 “세포, 동물, 인체적용시험을 통해 수축기 및 이완기 혈압 모두 감소 효과를 입증했고, 특히 수축기 혈압의 감소폭이 두드러져 항고혈압 및 심혈관 질환 예방에 도움을 줄 수 있다”고 설명했다. 이번 식약처의 기능성 인정으로 홍삼 특이 사포닌에 대한 혈압 조절 기능성 원료는 비티진에서만 독점 사용할 수 있다. 이에 따라 회사는 혈압 관리에 대한 소비자들의 건강 니즈를 반영, 배우 최수종, 고두심을 모델로 혈압 관리 전문 건강기능식품 프리미엄 제품인 ‘더루트알지쓰리 올인원’과 보급형 제품 ‘홍삼 혈압케어’ 신제품 2종을 동시에 출시한다. 카이스트(KAIST) 박사인 비티진 허율 대표는 “이번 기능성 인정은 단순한 홍삼 제품의 확장이 아니라, 특이 사포닌의 기능성을 과학적으로 입증한 혁신적인 성과”라며 “특히, 혈압 및 심혈관 질환으로 고민하는 분들은 물론, 검증된 홍삼 제품을 찾는 소비자들에게 새롭고 확실한 선택지가 될 것”이라고 강조했다. 한편, 비티진은 건강기능식품, 화장품, 플랫폼(헬퓨 App) 사업을 주력으로, 최근 고기능성 화장품 ‘공후하’ 모델로 가수 이찬원을 기용하며 신제품을 론칭하는 등 제품 라인업 강화에 속도를 내고 있으며, 내년도 코스닥 상장을 목표로 IPO를 추진중이다. 박시현 인턴기자 park.sihyun1@joongang.co.kr",2025. 4. 24. 09:20,http://v.daum.net/v/20250424092027890
"식약처 “와인 수입량은 늘고 수입액은 줄어…경기 침체 영향"""," 이 기사는 2025년 4월 23일 오전 11시 16분 조선비즈 RM리포트 사이트에 표출됐습니다. 지난 1분기 와인, 샴페인 등 과실주의 수입량이 전년 대비 크게 증가한 반면 수입액은 감소한 것으로 나타났다. 밀키트 등 즉석조리식품과 틱톡, 유튜브 등 소셜네트워크서비스(SNS)에서 유행했던 벌집꿀, 땅콩버터 등의 수입도 눈에 띄게 증가했다. 23일 식품의약품안전처는 ’2025년 1분기 식품 수입 동향’을 발표하면서 국내로 수입된 식품은 20만 3000여건, 86억6000만달러(약 12조 3656억원)로 전년 같은 기간 대비 수입 건수는 2.9%, 금액은 3.5% 증가했다고 밝혔다. 최근 국내 경기 침체의 영향으로 경제성을 우선시하고 1인 가구의 증가로 편의성을 선호하는 사회 분위기가 그대로 나타났다고 식약처는 전했다. 과실주 수입은 전년 1만2000톤에서 1만8000톤으로 47.9% 증가했으나 수입액은 1억1000만달러(1570억원)에서 1억 달러(1430억원)로 8.1% 감소했다. 수입 과실주 kg 당 단가는 작년 1분기 9.2달러에서 올해 1분기 5.7달러로 떨어졌다. 식약처는 “고가의 제품보다는 합리적인 가격과 적절한 품질의 제품을 선호하는 소비 심리가 반영된 것으로 보인다”고 설명했다. 가정에서 데우거나 끓여서 간편하게 섭취할 수 있는 밀키트 등 즉석조리식품 올해 1분기 수입액은 440만달러(63억원)로 작년 같은 기간(200만달러) 대비 114.5% 증가했다. 고등어 등 수산물을 손질‧가공한 필렛(Fillet) 형태 제품 수입액은 작년 1분기 8300만달러(1186억원)에서 올해 1분기 1억4000만달러(2000억원)로 64.9% 늘었다. 아울러 치즈, 전지분유, 버터 등 유가공품의 수입이 크게 늘었는데 국민 식생활의 서구화로 소비 패턴이 변화한 영향으로 분석된다. 아울러 SNS 트렌드와 관련된 제품의 수입이 크게 늘었다. 지난해부터 다양한 식재료를 얹은 ‘요거트 아이스크림’이 큰 인기를 얻자 벌집꿀의 수입이 급증했다. 수입액은 작년 1분기 1500달러(210만원)에서 올해 1분기 38만5000달러(5억5000만원)로 256배 뛰었다. ‘땅콩버터 다이어트’가 관심을 끌자 땅콩버터는 물론 견과류의 수입이 크게 증가했다. 지난 1분기 땅콩버터 수입액은 870만달러(124억원)로 전년 대비 101.7%, 견과류 수입액은 1억2000만달러(1715억원)로 전년 대비 38.1% 증가했다. 마시멜로우와 과자·건과일을 혼합해 만드는 ‘쫀득쿠키’가 유행하면서 마시멜로우의 수입도 늘었다. 국내 수급 불안정 등에 따른 물가조절용 식품의 수입량은 증가했다. 양파, 양배추, 배추, 감귤 등 신선 농산물의 1분기 수입량은 37만9000톤으로 전년 동기 대비 13.5% 증가했다. 반면 농·임산물 중 식품제조용 원료로 많이 사용하는 밀은 작년 1분기 73만9000톤에서 올 1분기 57만1000톤으로, 옥수수는 63만6000톤에서 59만4000톤으로 수입량이 감소했다. 최근 세계적인 이상기후, 재배면적 감소 등으로 인한 국제 곡물 가격 상승이 반영된 것으로 보인다. 해당 기간 동안 우리나라가 식품을 수입한 국가는 총 150개국으로, 그 중 미국(대두, 밀 등), 중국(김치, 폴리프로필렌 등), 호주(밀, 정제과정이 필요한 식품원료 등)에서 전체 수입량의 58.5%인 275만톤을 수입했다. 식약처는 “앞으로도 수입식품의 증감 현황, 국내외 소비 트렌드 등을 분석해 검사를 지속 강화하는 등 국민이 안심하고 수입식품을 소비할 수 있는 환경 조성하는데 최선을 다할 계획”이라고 밝혔다. - Copyright ⓒ 조선비즈 & Chosun.com -",2025. 4. 23. 11:17,http://v.daum.net/v/20250423111755924
"""위생용품업계 만나 체감 정책 만든다""…식약처, 간담회"," [서울=뉴시스]송종호 기자 = 식품의약품안전처가 국내 위생용품 업계와 만나 현장에서 체감할 수 있는 정책개선 방안을 모색했다. 식품의약품안전처는 서울 용산구 서울비즈센터에서 위생용품 업계와 토론회를 개최했다고 16일 밝혔다. 위생용품은 일회용 컵·숟가락·젓가락, 화장지, 종이냅킨 등 인체에 직·간접적으로 접촉하는 용품으로으로 위생용품 관리법에 근거해 관리하는 품목을 말한다. 이번 회의에는 위생용품업계, 학계 전문가, 소비자단체 등이 참석해 위생용품 안전관리 정책 방향에 대해 논의하고 위생용품 제조 현장 등에서 발생하는 애로사항을 청취했다. 또한 식약처가 지난 2022년부터 지난해까지 3차에 걸쳐 발굴해 추진하고 있는 식의약 규제혁신 과제 중 위생용품 분야에 대한 규제혁신 추진 상황과 성과를 공유하고, 올해 새롭게 추진할 규제혁신 방안을 모색했다. 식약처는 앞으로도 국민의 안전을 위해 위생용품 안전관리를 강화하는 한편, 위생용품 산업 발전을 위해 업계의 다양한 의견을 듣고 합리적인 규제개선 방안을 적극 발굴할 계획이다. 유현정 식약처 소비자위해예방국장은 ""그간 식약처는 위생용품 업계의 애로사항으로 작용하는 규제를 개선하기 위해 자가품질검사 주기를 완화하고, 국내 위생용품 수출 활성화를 위한 증명서 발급 규정을 마련하는 등 다양한 규제혁신 성과를 이뤄냈다""라고 말했다. 이어 ""오늘 논의한 내용을 검토해 새로운 규제개선 과제를 적극 발굴하고, 현장에서 체감할 수 있도록 법령정비 등을 신속히 추진하겠다""고 덧붙였다. ☞공감언론 뉴시스 song@newsis.com",2025. 4. 16. 15:01,http://v.daum.net/v/20250416150121633
"전라남도, 수산물 방사능 조사 2013년부터 식약처 기준에 모두 적합"," 25일 전라남도해양수산과학원은 지난 2013년부터 현재까지 전남에서 생산된 수산물 7,817건의 시료에 대한 방사능 조사를 추진한 결과, 모두 식품의약품안전처 기준에 적합해 안전한 것으로 확인됐다고 밝혔습니다. 전남도해양수산과학원은 2013년부터 현재까지 감마 핵종 4·베타 핵종 1 등 방사능 조사 장비 5대를 설치해 생산단계 수산물 방사능 조사를 추진하고 있습니다. 올해도 3억 5천만 원을 투입해 노후 장비 1대를 교체, 신속한 결과를 도출하고 분석 신뢰도를 높일 계획입니다. 특히 일본 후쿠시마 오염수 방류 시점인 2023년부터 방사능 조사 강화 계획을 수립하고, 조사 품종 및 건수를 확대하고 있습니다. 실제로 2022년 64품종 836건, 2023년 89품종 1,301건, 2024년 90품종 1,437건을 조사했습니다. 추가적으로 2024년부터는 주요 양식수산물 산지인 신안, 보성, 고흥, 여수의 4개 정점에서 양식장 주변 환경 방사성 물질을 모니터링하고 있습니다. 해수 및 퇴적물을 주기적으로 직접 채취해 인공 핵종(29종)과 자연 핵종(12종)을 조사한 후 원자력안전위원회 고시 기준과 비교 분석해 오염수 방류 전·후의 도내 분포 경향 확인에 필요한 실증 자료를 지속해서 축적하고 있습니다. 현재까지 분석한 양식장 환경 시료는 기준 범위에서 모두 적합한 것으로 나타났습니다. 조사 결과는 수산물에 대한 방사능 오염 우려를 불식하기 위해 전남도(https://www.jeonnam.go.kr)와 전남도해양수산과학원 누리집(https://ofsi.jeonnam.go.kr/sites/ofsi/index.do)에 매일 공개하고 있습니다. 김충남 전남도해양수산과학원장은 ""장기적으로 총 134만 톤을 방류한다는 일본 계획을 고려하면 안심은 금물""이라며 ""기준치 이하의 수치 변화도 세밀하게 살피는 등 국민 불안감 해소와 먹거리 안전에 더욱 신속하고 유기적으로 대응할 것""이라고 말했습니다. #방사능 #수산물 #적합 #식약처기준 #후쿠시마오염수 #전남도해양수산과학원 #전남",2025. 4. 25. 09:51,http://v.daum.net/v/20250425095102955
"식약처 '내손안', 모바일 어워드 코리아 3년 연속 대상"," 식품의약품안전처가 식품안전정보 애플리케이션(앱) '내손안(安)'으로 모바일 어워드 코리아 2025 공공서비스 부문 3년 연속 대상을 수상했다고 23일 밝혔다. 식약처가 2016년 개발한 내손안은 국내 제조·수입식품 정보와 업체 검색, 제품 회수·판매 중지 정보, 행정처분 현황, 건강기능식품·유해물질 정보 등을 쉽고 편리하게 확인할 수 있다. 지난해 말 기준 앱 다운로드 수 63만2500여건을 기록했다. 식약처 관계자는 “소비자가 참여한 인지도 평가와 전문가 심사에서 내손안 모바일 앱의 기술력과 경쟁력 등을 인정받았다”면서 “앞으로도 국민에게 식품 등과 관련된 다양한 안전 정보를 제공하고 접근성을 강화하겠다”고 말했다. 송윤섭 기자 sys@etnews.com",2025. 4. 23. 10:05,http://v.daum.net/v/20250423100510008
